{
  "$schema": "../../schemas/puzzle-circuit.schema.json",
  "id": "P3.2",
  "mechanic": "circuit",
  "chapter": "03-development-workflows",
  "quest": "Q3.8",
  "circuit": "flight",
  "$comment": "Two Circuits, round 2: the Lock Flight through the North Head (docs/specs/ISLAND-03-keelhaven.md §5.3). Part 1 (Q3.8, Stroud) takes your hull from the issue to a pull request through Lock 1; part 2 (Q3.9, Arlo) answers the two seeded pull requests at Lock 2. You seal Gate 1 after the diff and Gate 2 after the checks; the Sea Gate (the merge) stays shut for practice hulls. The hulls' names are the course's pull request titles (quests' signs).",
  "places": {
    "ledger": {
      "acts": "ledger",
      "name": "The work-order ledger",
      "means": "Start from a GitHub issue"
    },
    "bell": {
      "acts": "bell",
      "name": "The slipway bell",
      "means": "Start the session"
    },
    "slate": {
      "acts": "slate",
      "name": "Lock 1's slate",
      "means": "Review the diff"
    },
    "gate1": {
      "acts": "gate1",
      "name": "Gate 1",
      "means": "The first approval gate"
    },
    "petition": {
      "acts": "petition",
      "name": "The petition mast",
      "means": "Open the pull request"
    },
    "lamps": {
      "acts": "lamps",
      "name": "The lock lamps",
      "means": "Checks run on the pull request"
    },
    "note": {
      "acts": "note",
      "name": "The chalk note",
      "means": "A review comment"
    },
    "redLamp": {
      "acts": "redLamp",
      "name": "The red lamp",
      "means": "A failing check"
    },
    "barge": {
      "acts": "barge",
      "name": "The repair barge",
      "means": "A new session from the pull request"
    },
    "gate2": {
      "acts": "gate2",
      "name": "Gate 2",
      "means": "The second approval gate"
    },
    "seaGate": {
      "acts": "seaGate",
      "name": "The Sea Gate",
      "means": "The merge"
    }
  },
  "laps": [
    {
      "id": "issue",
      "quest": "Q3.8",
      "step": "flight",
      "solved": "solved",
      "close": "stroud.flight.solved",
      "title": "Lock 1: from an issue to a pull request",
      "order": "Make search case-insensitive",
      "stations": [
        {
          "id": "issue",
          "at": "ledger",
          "kind": "watch",
          "title": "Issue",
          "text": "You open the work order Make search case-insensitive in the Issues ledger.",
          "seconds": 3,
          "cite": "start"
        },
        {
          "id": "session",
          "at": "bell",
          "kind": "choose",
          "title": "Session",
          "prompt": "The order rings the bell at the main slipway. Where does the hull start?",
          "caption": "The issue, open in **Issues**.",
          "line": "kh.stroud.05",
          "image": "ch03/app-issue-new-session",
          "options": [
            {
              "id": "dock3",
              "text": "Drydock 3, on practice-search-case-bug, with Create from",
              "right": true,
              "result": "The hull starts in Drydock 3, where the bug is.",
              "line": "kh.stroud.06"
            },
            {
              "id": "main",
              "text": "The main slipway (the issue’s New session button)",
              "reason": "Search already works on main. There is nothing to fix there.",
              "backTo": "bell",
              "cite": "start"
            }
          ],
          "hints": [
            "Where does the bug live?",
            "The issue’s New session starts from main.",
            "Drydock 3, on practice-search-case-bug, with Create from."
          ],
          "cite": "start"
        },
        {
          "id": "loop",
          "at": "bell",
          "kind": "watch",
          "title": "The inner loop",
          "text": "Drydock 3’s crew runs the ring: five lamps light in turn, and the lookout shows hobbit and HOBBIT giving the same result.",
          "seconds": 6,
          "cite": "start"
        },
        {
          "id": "diff",
          "at": "slate",
          "kind": "choose",
          "title": "Diff",
          "prompt": "Read the marks on the slate. Is the diff ready for Gate 1?",
          "options": [
            {
              "id": "focused",
              "text": "Yes: only the search fix and its test",
              "right": true,
              "result": "The diff is focused."
            },
            {
              "id": "polish",
              "text": "Not yet: add the book card’s polish while the hull’s in",
              "reason": "That isn’t this issue. The Changes tab should hold only the focused search fix and its test.",
              "backTo": "slate",
              "cite": "start"
            }
          ],
          "cite": "start",
          "hints": [
            "What does the issue ask for?",
            "One fix, and the test that proves it.",
            "Yes: only the search fix and its test."
          ]
        },
        {
          "id": "gate1",
          "at": "gate1",
          "kind": "seal",
          "title": "Approval gate",
          "prompt": "Your approval gate. Read the evidence: the slate shows the search fix and its test. Seal Gate 1, or send it back?",
          "options": [
            {
              "id": "seal",
              "text": "Seal it: the diff holds only the search fix and its test",
              "right": true,
              "result": "Your seal goes on Gate 1, and the lock opens."
            },
            {
              "id": "test",
              "text": "Send it back: a test file changed too",
              "reason": "The test is part of the job: the plan asked for a focused regression test. Send back only what isn’t.",
              "backTo": "gate1",
              "cite": "start"
            },
            {
              "id": "claim",
              "text": "Seal it: Copilot says the fix works",
              "reason": "A confident response isn’t validated software. Seal on what the diff shows.",
              "backTo": "gate1",
              "cite": "evidence"
            }
          ],
          "cite": "outer",
          "hints": [
            "What’s on the slate?",
            "The fix and its test are the job.",
            "Seal it: the diff holds only the search fix and its test."
          ]
        },
        {
          "id": "petition",
          "at": "petition",
          "kind": "tiles",
          "title": "Pull request",
          "prompt": "Build the summary from what you saw, then hoist it (Create PR).",
          "line": "kh.stroud.07",
          "tiles": [
            {
              "id": "case",
              "text": "Search ignores letter case",
              "sticks": true
            },
            {
              "id": "test",
              "text": "Added a focused regression test",
              "sticks": true
            },
            {
              "id": "terminal",
              "text": "Tests and build passed in the terminal",
              "sticks": true
            },
            {
              "id": "preview",
              "text": "hobbit and HOBBIT match in the preview",
              "sticks": true
            },
            {
              "id": "ci",
              "text": "CI passed",
              "sticks": false,
              "reason": "No check has run yet. Claim only what the terminal or CI output shows.",
              "cite": "start"
            },
            {
              "id": "every",
              "text": "Fixed every search bug",
              "sticks": false,
              "reason": "Claim what you checked.",
              "cite": "start"
            }
          ],
          "cite": "start"
        },
        {
          "id": "checks",
          "at": "lamps",
          "kind": "watch",
          "title": "Checks",
          "text": "Lockfall’s leat fills Lock 1 by itself. The Book app web lamp runs amber, then green.",
          "line": "kh.stroud.08",
          "seconds": 5,
          "cite": "check"
        },
        {
          "id": "basin",
          "at": "seaGate",
          "kind": "choose",
          "title": "The merge",
          "prompt": "Your hull’s through Lock 1, her pull request open. The Sea Gate is the merge. Open it?",
          "options": [
            {
              "id": "shut",
              "text": "Keep it shut: it’s practice, and main already has the fix",
              "right": true,
              "result": "The Sea Gate stays shut, and your hull waits above it: open, not merged."
            },
            {
              "id": "open",
              "text": "Open it: every lamp is green",
              "reason": "Not this one. Don’t merge this practice pull request: the correct search behavior is already on main.",
              "backTo": "seaGate",
              "cite": "start"
            }
          ],
          "hints": [
            "Where does the search fix already live?",
            "main has it. This one’s practice.",
            "Keep it shut."
          ],
          "cite": "start"
        }
      ]
    },
    {
      "id": "feedback",
      "quest": "Q3.9",
      "step": "flight",
      "solved": "solved",
      "close": "arlo.solved",
      "title": "Lock 2: a note and a red lamp",
      "order": "Improve empty-state copy · Failing stats check practice",
      "stations": [
        {
          "id": "note",
          "at": "note",
          "kind": "choose",
          "title": "Feedback",
          "prompt": "The note asks for more helpful guidance. The barge comes alongside. Choose the revision.",
          "caption": "The comment on **Improve empty-state copy**.",
          "line": "kh.arlo.02",
          "image": "ch03/app-pr-review-comment",
          "options": [
            {
              "id": "whole",
              "text": "A message that names the search term, the genre and the reading status",
              "right": true,
              "result": "It answers the whole comment.",